,fandom,other_fandom,name,circle_code,event,circle_facebook,circle_instagram,circle_twitter,circle_other_socials,sampleworks_images,substring
623,"KPOP FANDOM (STRAY KIDS, NCT 127, NCT DREAM)","KPOP (STRAY KIDS, NCT 127, NCT DREAM, SNSD)",3 MusketarKetir,G-31b (SUN),CF18,-,https://instagram.com/3musketarketir,-,-,"['https://kumxjefxtrrpzalmwvvr.supabase.in/storage/v1/object/public/circle-sampleworks-18/67899471-a496-44aa-a6f6-bd56d9997c1d/74b1dadb-04ee-4bfe-8e34-fe6cdbbc82e2/G-31b (SUN).jpg', 'https://kumxjefxtrrpzalmwvvr.supabase.in/storage/v1/object/public/circle-sampleworks-18/67899471-a496-44aa-a6f6-bd56d9997c1d/5e61f4af-362e-49b7-8164-eebc04c606bf/G-31b (SUN).jpg', 'https://kumxjefxtrrpzalmwvvr.supabase.in/storage/v1/object/public/circle-sampleworks-18/67899471-a496-44aa-a6f6-bd56d9997c1d/bea92555-84a2-423a-a064-f9770f557b30/G-31b (SUN).jpg', 'https://kumxjefxtrrpzalmwvvr.supabase.in/storage/v1/object/public/circle-sampleworks-18/67899471-a496-44aa-a6f6-bd56d9997c1d/43681382-a16e-4e15-ae1e-76bc412f5bbe/G-31b (SUN).jpg', 'https://kumxjefxtrrpzalmwvvr.supabase.in/storage/v1/object/public/circle-sampleworks-18/67899471-a496-44aa-a6f6-bd56d9997c1d/c89dd0b1-3534-4857-811a-e21f72a655d7/G-31b (SUN).jpeg', 'https://kumxjefxtrrpzalmwvvr.supabase.in/storage/v1/object/public/circle-sampleworks-18/67899471-a496-44aa-a6f6-bd56d9997c1d/68cfa664-c538-41e0-8354-182ed99e94ea/G-31b (SUN).jpeg', 'https://kumxjefxtrrpzalmwvvr.supabase.in/storage/v1/object/public/circle-sampleworks-18/67899471-a496-44aa-a6f6-bd56d9997c1d/5d6a9f82-d77d-4d65-af92-0051e0165d14/G-31b (SUN).jpeg', 'https://kumxjefxtrrpzalmwvvr.supabase.in/storage/v1/object/public/circle-sampleworks-18/67899471-a496-44aa-a6f6-bd56d9997c1d/9aaacfe8-10de-4c65-abdb-9dea1d309fad/G-31b (SUN).jpeg', 'https://kumxjefxtrrpzalmwvvr.supabase.in/storage/v1/object/public/circle-sampleworks-18/67899471-a496-44aa-a6f6-bd56d9997c1d/b6d9ea35-3927-47e2-adb2-8a31d325eaec/G-31b (SUN).jpeg', 'https://kumxjefxtrrpzalmwvvr.supabase.in/storage/v1/object/public/circle-sampleworks-18/67899471-a496-44aa-a6f6-bd56d9997c1d/8554b838-a99f-4ed9-aa34-1c67d4833d98/G-31b (SUN).jpeg']",RE
628,KPOP,"ANIME & MANGA (CARDCAPTOR SAKURA, CHAINSAW MAN, KOCCHIMUITTE! MIIKO, KOMI-SAN CAN'T COMMUNICATE, ONE PIECE, SHOWA ERA ANIME, STUDIO GHIBLI, SPY X FAMILY, TAMAGOTCHI), CAPYBARA, MARVEL, HAPPY CAT + BANANA CAT MEME, ANIMATION/FILMS/PROJECTS (AKIRA, ARI ASTER FILMS, HAZBIN HOTEL, HELLUVA BOSS, THE AMAZING DIGITAL CIRCUS, SCOTT PILGRIM, POKEMIKU PROJECT VOLTAGE, SPIKE JONZE FILMS, WES ANDERSON FILMS, WONG KAR WAI FILMS), GAMES (ACNH, DEGREES OF LEWDITY, FIVE NIGHTS AT FREDDY'S, GENSHIN IMPACT, IDENTITY V, KIRBY, RAGNAROK ONLINE, SEAL ONLINE, VALORANT), ORIGINAL ARTS, OC, CUTE ANIMALS, KPOP/KOREAN SCENE (AESPA, BIBI, BLACKPINK, BTS, CODEKUNST, DPR IAN, DPR LIVE, (G)I-DLE, IU, LE SSERAFIM, NCT, NCT 127, NEWJEANS, PLAVE, RED VELVET, SEVENTEEN, WAVE TO EARTH, WINNER, MORE KHH&KRNB), JPOP (ADO, BABYMETAL, FUJII KAZE, XG), NIKI, SABRINA CARPENTER",monstre planet,G-37ab,CF18,-,"https://instagram.com/adoredthree/ , instagram.com/monstreplanet , instagram.com/mrsabamiso/ , instagram.com/norayaki__/, instagram.com/peacherpeach.pins/, https://www.instagram.com/peacherpeachy/","twitter.com/adoredthree, twitter.com/monstreplanet, twitter.com/MrSabamiso, twitter.com/peacherpeach_p, twitter.com/peacherpeachy","tiktok.com/@adoredthree, tiktok.com/@peacherpeachy",,RE
650,ANIME/VTUBER,"VALORANT, FRIEREN, BLUE LOCK.",Clownies (sugar),G-56ab,CF18,,https://www.instagram.com/llydaannam/,https://twitter.com/nadifashafira_,,,RE
651,KAWAII CHARACTERS,"PLANNER STICKERS, STICKER RECEH",Kawaiisphere Creators,G-57ab,CF18,,https://www.instagram.com/kawaiisphere.id/,,,,RE
654,"GENSHIN IMPACT, KANCOLLE, HONKAI STAR RAIL","STREET FIGTHER, TEKKEN",RANDOMNESSTHINK,H-01ab,CF18,https://www.facebook.com/Randomnessthink/,https://www.instagram.com/lingkar_sen/,https://twitter.com/CentarumLake,,,RE
656,HONKAI STAR RAIL,"PROJECT SEKAI: COLORFUL STAGE!, REVERSE 1999, PUELLA MADOKA MAGICA, GENSHIN IMPACT, NEWJEANS, COOKIE RUN KINGDOM, ARKNIGHTS, ALIEN STAGE, OMORI, BOCCHI THE ROCK!, VOCALOID, LIMBUS COMPANY, MOB PSYCHO 100, ADVENTURE TIME, HOYOVERSE, CHAINSAWMAN, WITCH HAT ATELIER, FRIEREN: BEYOND JOURNEY'S END, DUNGEON MESHI, MILGRAM, JUJUTSU KAISEN, BLUE LOCK, ENSEMBLE STARS!, HOLOLIVE ID, HOLOSTARS ID, SPY × FAMILY, HAIKYU!!, EIGHTY SIX, THE APOTHECARY DIARIES, INAZUMA ELEVEN",DDR Dendeng Rebus,H-04ab,CF18,,https://instagram.com/nomajuu,https://twitter.com/nomajuu_,,,RE
663,HONKAI STAR RAIL,"ORIGINAL, REVERSE: 1999, GENSHIN IMPACT, IDENTITY V, ARKNIGHTS, THE AMAZING DIGIAL CIRCUS, FNAF, SOUSOU NO FRIEREN, HETALIA, TRIGUN",Cuanisme & Mostdeep Games,H-09ab/H-10ab,CF18,,https://www.instagram.com/keroshoku_,https://twitter.com/KeroShoku,,,RE
665,HONKAI STAR RAIL,"GENSHIN IMPACT, FRIEREN, ORIGINAL MERCH, JUJUTSU KAISEN, HAZBIN HOTEL, PLAVE",BABU NGEPET,H-12a,CF18,,,,,"['https://kumxjefxtrrpzalmwvvr.supabase.in/storage/v1/object/public/circle-sampleworks-18/7989706f-9d05-4c08-95b7-2de40006d333/b9081649-b6f3-44bb-b63c-8f58e65ba6c5/H-12a.png', 'https://kumxjefxtrrpzalmwvvr.supabase.in/storage/v1/object/public/circle-sampleworks-18/7989706f-9d05-4c08-95b7-2de40006d333/636d6e54-c41d-4b83-9435-c4af07ed1dad/H-12a.jpg', 'https://kumxjefxtrrpzalmwvvr.supabase.in/storage/v1/object/public/circle-sampleworks-18/7989706f-9d05-4c08-95b7-2de40006d333/1fe0ae19-c568-4d0d-a5fe-aae603602474/H-12a.jpg']",RE
684,HONKAI: STAR RAIL,"GENSHIN IMPACT, UNNAMED (VTUBER), RESIDENT EVIL, OMORI, VALORANT, MOBILE LEGEND",pengepetan ayangerz:,H-28ab,CF18,,,,,,RE
685,HONKAI STAR RAIL,"PERSONA SERIES, FRIEREN, ORV, FINAL FANTASY VII , REVERSE : 1999, GENSHIN IMPACT, BLUE LOCK, ONE PIECE, IDENTITY V, ORIGINAL CAT",Susu Murni Sari Boti,H-29a,CF18,https://www.facebook.com/Kezia.kezii,https://www.instagram.com/kez.ikez/,https://twitter.com/Keziikezz,https://www.instagram.com/keziikez/,"['https://kumxjefxtrrpzalmwvvr.supabase.in/storage/v1/object/public/circle-sampleworks-18/fd5c0e1e-1e21-495b-8462-18ff82207a9d/34e589aa-e514-4716-9f65-44428caea10e/H-29a.png', 'https://kumxjefxtrrpzalmwvvr.supabase.in/storage/v1/object/public/circle-sampleworks-18/fd5c0e1e-1e21-495b-8462-18ff82207a9d/da5af686-3b5d-42d8-991b-9d9470c2f9bf/H-29a.png', 'https://kumxjefxtrrpzalmwvvr.supabase.in/storage/v1/object/public/circle-sampleworks-18/fd5c0e1e-1e21-495b-8462-18ff82207a9d/fa4c205c-47df-4c10-9055-d56d1aafe12b/H-29a.png', 'https://kumxjefxtrrpzalmwvvr.supabase.in/storage/v1/object/public/circle-sampleworks-18/fd5c0e1e-1e21-495b-8462-18ff82207a9d/660e53dc-9767-4590-88c9-6a2c29b81524/H-29a.png', 'https://kumxjefxtrrpzalmwvvr.supabase.in/storage/v1/object/public/circle-sampleworks-18/fd5c0e1e-1e21-495b-8462-18ff82207a9d/5540c3aa-6dc8-4e48-ba85-b84173f7b9ad/H-29a.png', 'https://kumxjefxtrrpzalmwvvr.supabase.in/storage/v1/object/public/circle-sampleworks-18/fd5c0e1e-1e21-495b-8462-18ff82207a9d/cb270f8f-9240-4513-91e3-dada6c047607/H-29a.png', 'https://kumxjefxtrrpzalmwvvr.supabase.in/storage/v1/object/public/circle-sampleworks-18/fd5c0e1e-1e21-495b-8462-18ff82207a9d/da21ed6f-fa89-4cb1-82ec-29dca56c4fa0/H-29a.png', 'https://kumxjefxtrrpzalmwvvr.supabase.in/storage/v1/object/public/circle-sampleworks-18/fd5c0e1e-1e21-495b-8462-18ff82207a9d/d4c5e5ab-f4c7-4862-8680-74140619120c/H-29a.png', 'https://kumxjefxtrrpzalmwvvr.supabase.in/storage/v1/object/public/circle-sampleworks-18/fd5c0e1e-1e21-495b-8462-18ff82207a9d/86c93911-7e72-4249-87fa-a86ec65e5bed/H-29a.png', 'https://kumxjefxtrrpzalmwvvr.supabase.in/storage/v1/object/public/circle-sampleworks-18/fd5c0e1e-1e21-495b-8462-18ff82207a9d/98cee630-235f-4527-a3c8-0f493a9ec4a7/H-29a.png']",RE
687,GENSHIN IMPACT,"FREE!, PARADOX LIVE, SLICE OF LIFE",Delulu atelier,H-30a (SAT),CF18,,,,,,RE
689,GENSHIN IMPACT,"HONKAI STAR RAIL, FRIEREN, ORIGINAL ART",Emineko,H-30b (SAT),CF18,,https://www.instagram.com/eminekostudio/,https://twitter.com/EminekoStudio,,,RE
690,"GENSHIN IMPACT, HSR, VTUBER, FE,","HONKAI STAR RAIL, FIRE EMBLEM, HOLOLIVE, NIJISAMROFMAO, PROJECT SEKAI, PROJECT MOON, LIMBUS COMPANY, LOBOTOMY CORPORATION, MANA KHEMIA, IDOLISH 7, PERSONA SERIES, TENSAI OUJI, LINK CLICK",Terima Kos Janda x tsumetaku sakusaku,H-31ab,CF18,https://www.facebook.com/memeraja123/posts/pfbid02cijenqiNepCjdaH1JPBNdKkpPpyJzskH2jEzLhob4pXV1tuoeGTbWwFqHFMTBYpsl,,https://twitter.com/emilebois,,"['https://kumxjefxtrrpzalmwvvr.supabase.in/storage/v1/object/public/circle-sampleworks-18/ff7c3014-37c7-487a-b994-60b30de2ec5a/0116c718-e771-4636-a52f-c140a9883ebe/H-31ab.jpg', 'https://kumxjefxtrrpzalmwvvr.supabase.in/storage/v1/object/public/circle-sampleworks-18/ff7c3014-37c7-487a-b994-60b30de2ec5a/dbc78c9a-d1dc-4c31-8254-fda8c1111f40/H-31ab.jpg', 'https://kumxjefxtrrpzalmwvvr.supabase.in/storage/v1/object/public/circle-sampleworks-18/ff7c3014-37c7-487a-b994-60b30de2ec5a/e232f272-995a-481c-839c-bbc787797540/H-31ab.jpg', 'https://kumxjefxtrrpzalmwvvr.supabase.in/storage/v1/object/public/circle-sampleworks-18/ff7c3014-37c7-487a-b994-60b30de2ec5a/537cd84a-60da-484a-b506-f47de1c2fdaa/H-31ab.jpg', 'https://kumxjefxtrrpzalmwvvr.supabase.in/storage/v1/object/public/circle-sampleworks-18/ff7c3014-37c7-487a-b994-60b30de2ec5a/d6d70916-2630-42f4-94cf-30378e5ac0d5/H-31ab.jpg', 'https://kumxjefxtrrpzalmwvvr.supabase.in/storage/v1/object/public/circle-sampleworks-18/ff7c3014-37c7-487a-b994-60b30de2ec5a/753f9eb8-c82e-4604-a28f-948113f18d07/H-31ab.png']",RE
695,GENSHIN IMPACT,"REVERSE1999, HONKAI STAR RAIL",Lapak Pamer Gacha (LPG),H-36b,CF18,,,https://x.com/serulingbambuw/status/1779512185309528565,,"['https://kumxjefxtrrpzalmwvvr.supabase.in/storage/v1/object/public/circle-sampleworks-18/de1b0b3e-f37e-422b-ad3e-3f3527ad3275/5964722d-617e-4f87-a18a-207899375cd2/H-36b.png', 'https://kumxjefxtrrpzalmwvvr.supabase.in/storage/v1/object/public/circle-sampleworks-18/de1b0b3e-f37e-422b-ad3e-3f3527ad3275/fd4aea98-9c2e-4ca4-9ed5-5266dd6773ff/H-36b.png', 'https://kumxjefxtrrpzalmwvvr.supabase.in/storage/v1/object/public/circle-sampleworks-18/de1b0b3e-f37e-422b-ad3e-3f3527ad3275/45c4e64d-fd1e-43ed-a7f1-34250599b437/H-36b.png', 'https://kumxjefxtrrpzalmwvvr.supabase.in/storage/v1/object/public/circle-sampleworks-18/de1b0b3e-f37e-422b-ad3e-3f3527ad3275/87788d47-2c0a-4f39-9031-0031f7789dd4/H-36b.png', 'https://kumxjefxtrrpzalmwvvr.supabase.in/storage/v1/object/public/circle-sampleworks-18/de1b0b3e-f37e-422b-ad3e-3f3527ad3275/f5539256-e002-4e21-902b-54169fd1696a/H-36b.png', 'https://kumxjefxtrrpzalmwvvr.supabase.in/storage/v1/object/public/circle-sampleworks-18/de1b0b3e-f37e-422b-ad3e-3f3527ad3275/8f0f8bca-b179-4419-830c-5bba9d21af57/H-36b.png', 'https://kumxjefxtrrpzalmwvvr.supabase.in/storage/v1/object/public/circle-sampleworks-18/de1b0b3e-f37e-422b-ad3e-3f3527ad3275/667d3e63-1832-402e-a460-be5fa403ae7f/H-36b.png', 'https://kumxjefxtrrpzalmwvvr.supabase.in/storage/v1/object/public/circle-sampleworks-18/de1b0b3e-f37e-422b-ad3e-3f3527ad3275/40e6f73e-29f6-4903-b481-7e0d5f5efcda/H-36b.png', 'https://kumxjefxtrrpzalmwvvr.supabase.in/storage/v1/object/public/circle-sampleworks-18/de1b0b3e-f37e-422b-ad3e-3f3527ad3275/8269604f-48aa-4596-8fe4-d9660834518d/H-36b.png', 'https://kumxjefxtrrpzalmwvvr.supabase.in/storage/v1/object/public/circle-sampleworks-18/de1b0b3e-f37e-422b-ad3e-3f3527ad3275/7386b90b-60bc-45af-b3b2-e3e19915775b/H-36b.png']",RE
700,HONKAI STAR RAIL,"GENSHIN IMPACT, JOJO BIZARRE ADVENTURES, GAME (POKEMON / DIGIMON)",smolworld,H-38ab,CF18,-,https://www.instagram.com/smolworldcircle?igsh=Zzk4ZWtpcWhubjl1,https://twitter.com/fuumabou,,,RE
702,HONKAI STAR RAIL,"VOCALOID, GENSHIN IMPACT, ENSEMBLE STARS, OMNISCIENT READER'S VIEWPOINT, PROJECT SEKAI, HAZBIN HOTEL, HELLUVA BOSS, PIKMIN, DIGITAL CIRCUS, PERSONA 5, HOLOLIVE",Sugomerch,H-41ab,CF18,,,,,,RE
704,HONKAI STAR RAIL,"GENSHIN IMPACT, HONKAI IMPACT 3RD, REVERSE 1999, JUJUTSU KAISEN, BLUE LOCK, EVE UTAITE",Beterly Beterei,H-43ab,CF18,,https://www.instagram.com/bebektrbng12?igsh=MWRsMGJ6eGJwb2ZqNA==,https://x.com/bebekterbang12?s=21,,,RE
709,HONKAI STAR RAIL,"VOCALOID,ENSEMBLE STARS,HOLOSTARS,ATEEZ,ANIMAL CROSSING,FRIEREN,GENSHIN IMPACT,TWISTED WONDERLAND,FNAF,DEAD MOUNT DEAD PLAY",S354T,H-46ab,CF18,,https://www.instagram.com/venus.lostkidd?igsh=MTAzbGR4YjJvbDYzag==,https://x.com/hwa_kkyun?t=nHTVOPQxuEIaCDnT6WQ41A&s=09,,,RE
718,HONKAI STAR RAIL,"VOCALOID, PROJECT SEKAI, HOLOLIVE, SPIDERVERSE, JUJUTSU KAISEN, IDENTITY V, LEAGUE OF LEGENDS, TWISTED WONDERLAND, BLUE ARCHIVE, ELDEN RING, PERSONA, TEARS OF THEMIS, RESIDENT EVIL. KIRBY, STUDIO GHIBLI, ORIGINAL, NIKKE",sushipuro,H-54ab,CF18,-,https://instagram.com/sushipuro,-,,,RE
720,HONKAI STAR RAIL,"OMNISCIENT READER VIEWPOINT, ARCANE, JJK, GENSHIN,CSM",Seblak Krupuk Mas Jun,H-57ab,CF18,,trea.co,treaa_co,,,RE
721,GENSHIN IMPACT,"HUNTER X HUNTER, ENSTARS, HONKAI STAR RAIL, FRIEREN, PARADOX LIVE, BUNGOU STRAY DOGS, JUJUTSU KAISEN, BLUE LOCK, NU: CARNI, CALL OF DUTY, UNDERTALE/DELTARUNE, MORTAL KOMBAT",KBBI (Kak Beli Barang Ini),H-58ab,CF18,,,,,"['https://kumxjefxtrrpzalmwvvr.supabase.in/storage/v1/object/public/circle-sampleworks-18/32f75085-887a-46c7-b290-e22db50e89ff/502ee697-d7c0-4d94-b9f1-9670739d4fbc/H-58ab.jpg', 'https://kumxjefxtrrpzalmwvvr.supabase.in/storage/v1/object/public/circle-sampleworks-18/32f75085-887a-46c7-b290-e22db50e89ff/c55e06f7-19bb-4e9f-9646-e3a2f430b5c9/H-58ab.jpg', 'https://kumxjefxtrrpzalmwvvr.supabase.in/storage/v1/object/public/circle-sampleworks-18/32f75085-887a-46c7-b290-e22db50e89ff/1eb7cc00-b33d-45f4-ad74-21cd47a96536/H-58ab.jpg', 'https://kumxjefxtrrpzalmwvvr.supabase.in/storage/v1/object/public/circle-sampleworks-18/32f75085-887a-46c7-b290-e22db50e89ff/8df4beb0-e27c-4e9c-99f9-35b85fb694dd/H-58ab.jpg', 'https://kumxjefxtrrpzalmwvvr.supabase.in/storage/v1/object/public/circle-sampleworks-18/32f75085-887a-46c7-b290-e22db50e89ff/ca092787-4d8b-4522-976f-9f01dec02ef3/H-58ab.jpg']",RE
722,HONKAI: STAR RAIL,"ORIGINAL ART, GI, DANGANRONPA, OMORI, DUNGEON MESHI, HOLOSTAR, FRIEREN: BEYOND JOURNEY'S END, POKEMON, MINECRAFT, NINTENDO, VALORANT, TEARS OF THEMIS",RandomIN,H-59a,CF18,,https://www.instagram.com/randomin.studio/,https://twitter.com/randomanin,,,RE
726,GENSHIN IMPACT,"REVERSE: 1999, TOILET-BOUND HANAKO KUN, HONKAI STAR RAIL, HETALIA, SPYXFAMILY, BLUE LOCK, RESIDENT EVIL",Waroeng Pelangih,H-60b (SAT),CF18,,https://www.instagram.com/waroeng_pelangih?igsh=MWRrYW5oZGdoa2JhYw==,https://twitter.com/Bee_Th0ven,https://twitter.com/Yunkawan,"['https://kumxjefxtrrpzalmwvvr.supabase.in/storage/v1/object/public/circle-sampleworks-18/8c81fbee-955c-476f-a1db-58a96846eb6d/c3f0945d-6b2f-47b4-87fa-fb757cf134bc/H-60b (SAT).png', 'https://kumxjefxtrrpzalmwvvr.supabase.in/storage/v1/object/public/circle-sampleworks-18/8c81fbee-955c-476f-a1db-58a96846eb6d/9465453c-89a2-4853-b5c4-edffd8bea19c/H-60b (SAT).png', 'https://kumxjefxtrrpzalmwvvr.supabase.in/storage/v1/object/public/circle-sampleworks-18/8c81fbee-955c-476f-a1db-58a96846eb6d/bd688554-e2a0-4a42-8b2f-1e5d5facd4f8/H-60b (SAT).png', 'https://kumxjefxtrrpzalmwvvr.supabase.in/storage/v1/object/public/circle-sampleworks-18/8c81fbee-955c-476f-a1db-58a96846eb6d/62ea63c9-f78b-44ab-972d-f17f6dc9304a/H-60b (SAT).png', 'https://kumxjefxtrrpzalmwvvr.supabase.in/storage/v1/object/public/circle-sampleworks-18/8c81fbee-955c-476f-a1db-58a96846eb6d/a747b94a-882f-468c-8256-230d28959335/H-60b (SAT).png', 'https://kumxjefxtrrpzalmwvvr.supabase.in/storage/v1/object/public/circle-sampleworks-18/8c81fbee-955c-476f-a1db-58a96846eb6d/4748a85d-02b7-4306-981e-c418124e9b7c/H-60b (SAT).png', 'https://kumxjefxtrrpzalmwvvr.supabase.in/storage/v1/object/public/circle-sampleworks-18/8c81fbee-955c-476f-a1db-58a96846eb6d/45dd5941-7f81-4515-9098-f5e79048a874/H-60b (SAT).png', 'https://kumxjefxtrrpzalmwvvr.supabase.in/storage/v1/object/public/circle-sampleworks-18/8c81fbee-955c-476f-a1db-58a96846eb6d/6290eb5a-d338-4e0b-87d6-20eb6af9b967/H-60b (SAT).png']",RE
733,"HOYOVERSE (GENSHIN IMPANG, HONKAI STAR RAIL)","EVANGELION, OMORI, HAIKYUU, STUDIO GHIBLI, FRIEREN, VIOLET EVERGARDEN, ETC.",pecutelier,I-04ab,CF18,,https://instagram.com/nanatsuoh,https://twitter.com/irenneparamitha,,,RE
742,GENSHIN IMPACT,"HONKAI STAR RAIL, PROJECT SEKAI, TWISTED WONDERLAND, HAIKYUU, PERSONA 3, JUJUTSU KAISEN, ZZZ, ARKNIGHTS, BOCCHI THE ROCK, SOUSOU NO FRIEREN, BLUE LOCK, GHIBLI, MONSTER HUNTER, VALORANT, ORIGINAL",Budak Teyvat x Go Go Peanuts,I-09ab/I-10ab,CF18,-,"https://www.instagram.com/gogo.peanuts/, https://www.instagram.com/cerullion/, https://www.instagram.com/vicksagita/, https://www.instagram.com/ararara496/","https://twitter.com/michiierry, https://twitter.com/Wasabi_hijau. https://twitter.com/lacria97, https://twitter.com/kavehlatteart",,,RE
751,GENSHIN IMPACT,"JUJUTSU KAISEN, OMNISCIENT READER'S VIEWPOINT, CHAINSAW MAN, UMIBE NO ETRANGER, JOJO'S BIZZARE ADVENTURE, SPY X FAMILY, EVANGELION, REVERSE: 1999",froog,I-15b,CF18,,https://www.instagram.com/justdotfroog?utm_source=ig_web_button_share_sheet&igsh=ZDNlZDc0MzIxNw==,https://x.com/justdotfroog?t=pbXOr5MrjV3z22mQWagf4Q&s=09,,"['https://kumxjefxtrrpzalmwvvr.supabase.in/storage/v1/object/public/circle-sampleworks-18/4cb4fede-35ef-40aa-89e5-dd58fbe9d5c0/dc7ac628-9ef9-4bb1-a46c-7ef4871cbf40/I-15b.png', 'https://kumxjefxtrrpzalmwvvr.supabase.in/storage/v1/object/public/circle-sampleworks-18/4cb4fede-35ef-40aa-89e5-dd58fbe9d5c0/cf389b7a-afb0-4aef-80fa-84d1c962c372/I-15b.png', 'https://kumxjefxtrrpzalmwvvr.supabase.in/storage/v1/object/public/circle-sampleworks-18/4cb4fede-35ef-40aa-89e5-dd58fbe9d5c0/f53c0315-ccc5-4700-abfe-cec62d46a5c3/I-15b.png', 'https://kumxjefxtrrpzalmwvvr.supabase.in/storage/v1/object/public/circle-sampleworks-18/4cb4fede-35ef-40aa-89e5-dd58fbe9d5c0/063340dc-e054-4375-b3eb-16d5aeb329fa/I-15b.png', 'https://kumxjefxtrrpzalmwvvr.supabase.in/storage/v1/object/public/circle-sampleworks-18/4cb4fede-35ef-40aa-89e5-dd58fbe9d5c0/0330f3a5-64fd-4a08-a972-b481549a6c25/I-15b.png', 'https://kumxjefxtrrpzalmwvvr.supabase.in/storage/v1/object/public/circle-sampleworks-18/4cb4fede-35ef-40aa-89e5-dd58fbe9d5c0/ad0b1271-ac74-4603-8d08-a4afab798946/I-15b.png', 'https://kumxjefxtrrpzalmwvvr.supabase.in/storage/v1/object/public/circle-sampleworks-18/4cb4fede-35ef-40aa-89e5-dd58fbe9d5c0/f84bf2e1-e727-4130-8e39-57d89b7e2a4b/I-15b.jpg', 'https://kumxjefxtrrpzalmwvvr.supabase.in/storage/v1/object/public/circle-sampleworks-18/4cb4fede-35ef-40aa-89e5-dd58fbe9d5c0/6da46a2e-a100-4601-99b0-f50cd817e387/I-15b.jpg', 'https://kumxjefxtrrpzalmwvvr.supabase.in/storage/v1/object/public/circle-sampleworks-18/4cb4fede-35ef-40aa-89e5-dd58fbe9d5c0/cd2305b2-850e-4367-adcd-0fb79ccbea8e/I-15b.png', 'https://kumxjefxtrrpzalmwvvr.supabase.in/storage/v1/object/public/circle-sampleworks-18/4cb4fede-35ef-40aa-89e5-dd58fbe9d5c0/f2e9f0b6-7c0f-4278-9ac3-590a5fa50075/I-15b.jpg']",RE
759,GENSHIN IMPACT,"JUJUTSU KAISEN, YOASOBI, XDINARY HEROES, OMNISCIENT READER'S VIEWPOINT",Pemuda Tepar x Funshine,I-22b,CF18,,https://www.instagram.com/pemudatepar,https://x.com/pemudatepar,,,RE
766,"HOYOVERSE STAR RAIL, GENSHIN","ANIME GIRL AND BOY, VOCALOID, SERIAL EXPERIMENTS LAIN, NEEDY STREAMER OVERDOSE, CSM, ORV",sakanaa~,I-29a,CF18,,,,,,RE
767,GESHIN IMPACT,"HONKAI STAR RAIL, ZENLESS ZONE ZERO, SKY: CHILDREN OF THE LIGHT.",Blooms Atelier,I-29b,CF18,,"https://www.instagram.com/koyohangatt/ , https://www.instagram.com/kathmudkip/, https://www.instagram.com/bloomsatelier.id/",https://twitter.com/koyohangatt,,"['https://kumxjefxtrrpzalmwvvr.supabase.in/storage/v1/object/public/circle-sampleworks-18/be96d17c-9dee-4e84-b659-4cf71b285681/ed3b58f3-6755-446b-8d60-3800c1dcacb5/I-29b.png', 'https://kumxjefxtrrpzalmwvvr.supabase.in/storage/v1/object/public/circle-sampleworks-18/be96d17c-9dee-4e84-b659-4cf71b285681/b255f1b5-88d3-4785-b922-bf26217a2772/I-29b.png', 'https://kumxjefxtrrpzalmwvvr.supabase.in/storage/v1/object/public/circle-sampleworks-18/be96d17c-9dee-4e84-b659-4cf71b285681/44e2f168-720d-4f9b-bbf9-8a60beafb8dc/I-29b.png', 'https://kumxjefxtrrpzalmwvvr.supabase.in/storage/v1/object/public/circle-sampleworks-18/be96d17c-9dee-4e84-b659-4cf71b285681/b0d165b4-a8e2-42d4-9cf2-c0c9a932415b/I-29b.png', 'https://kumxjefxtrrpzalmwvvr.supabase.in/storage/v1/object/public/circle-sampleworks-18/be96d17c-9dee-4e84-b659-4cf71b285681/c5f177fd-198d-4176-bc84-d761b663954a/I-29b.png', 'https://kumxjefxtrrpzalmwvvr.supabase.in/storage/v1/object/public/circle-sampleworks-18/be96d17c-9dee-4e84-b659-4cf71b285681/d634639d-1895-45ed-893e-074b705b46f7/I-29b.png', 'https://kumxjefxtrrpzalmwvvr.supabase.in/storage/v1/object/public/circle-sampleworks-18/be96d17c-9dee-4e84-b659-4cf71b285681/67fa3310-3274-4627-9343-6693e6ac4204/I-29b.png', 'https://kumxjefxtrrpzalmwvvr.supabase.in/storage/v1/object/public/circle-sampleworks-18/be96d17c-9dee-4e84-b659-4cf71b285681/3dbf9a64-efd0-4f5b-9a9a-ed40919da7f8/I-29b.png', 'https://kumxjefxtrrpzalmwvvr.supabase.in/storage/v1/object/public/circle-sampleworks-18/be96d17c-9dee-4e84-b659-4cf71b285681/257d8c36-2a57-47de-b117-83561a0fd15e/I-29b.png', 'https://kumxjefxtrrpzalmwvvr.supabase.in/storage/v1/object/public/circle-sampleworks-18/be96d17c-9dee-4e84-b659-4cf71b285681/e696e580-1c46-4a36-a926-1c683aca9699/I-29b.png']",RE
769,GENSHIN IMPACT,FIVE NIGHTS AT FREDDY'S,Decoffeenated Luwak,I-30a (SUN),CF18,,https://www.instagram.com/kkaerikko?igsh=MWhmdnhscDN2ZnZ1Yw==,,,,RE
774,GENSHIN IMPACT,"REVERSE 1999, HOLOLIVE, HONKAI: STAR RAIL, TEARS OF THEMIS, VOCALOID, PROJECT SEKAI, GENSHIN IMPACT",Tsukumotachi,I-32ab/I-33ab,CF18,,https://www.instagram.com/tsukumotachi?igsh=a2xubGJkYXFwN2Rj,,,"['https://kumxjefxtrrpzalmwvvr.supabase.in/storage/v1/object/public/circle-sampleworks-18/63079d72-8e81-4200-ba2f-ba19706e323a/1506e1e0-dc4c-4579-b42e-11d01935a9b1/I-32ab/I-33ab.png', 'https://kumxjefxtrrpzalmwvvr.supabase.in/storage/v1/object/public/circle-sampleworks-18/63079d72-8e81-4200-ba2f-ba19706e323a/fc19f319-20d2-426b-b691-e3e8fdd42ae3/I-32ab/I-33ab.png', 'https://kumxjefxtrrpzalmwvvr.supabase.in/storage/v1/object/public/circle-sampleworks-18/63079d72-8e81-4200-ba2f-ba19706e323a/505e2908-3934-4981-8957-39e813842417/I-32ab/I-33ab.png', 'https://kumxjefxtrrpzalmwvvr.supabase.in/storage/v1/object/public/circle-sampleworks-18/63079d72-8e81-4200-ba2f-ba19706e323a/22f7de4d-2aff-4057-96d3-41930a50c40c/I-32ab/I-33ab.png', 'https://kumxjefxtrrpzalmwvvr.supabase.in/storage/v1/object/public/circle-sampleworks-18/63079d72-8e81-4200-ba2f-ba19706e323a/0f8636ed-f3ca-41ec-bdfc-9cd321634c6a/I-32ab/I-33ab.png', 'https://kumxjefxtrrpzalmwvvr.supabase.in/storage/v1/object/public/circle-sampleworks-18/63079d72-8e81-4200-ba2f-ba19706e323a/e7fcd0ae-2132-4637-9271-ca57eedb3850/I-32ab/I-33ab.png', 'https://kumxjefxtrrpzalmwvvr.supabase.in/storage/v1/object/public/circle-sampleworks-18/63079d72-8e81-4200-ba2f-ba19706e323a/7391c741-5950-4057-8433-6b391dc9a07b/I-32ab/I-33ab.png', 'https://kumxjefxtrrpzalmwvvr.supabase.in/storage/v1/object/public/circle-sampleworks-18/63079d72-8e81-4200-ba2f-ba19706e323a/a2d8c5ae-08fe-460c-89d5-362ecac5d516/I-32ab/I-33ab.png', 'https://kumxjefxtrrpzalmwvvr.supabase.in/storage/v1/object/public/circle-sampleworks-18/63079d72-8e81-4200-ba2f-ba19706e323a/b80e9601-c2eb-40e2-99b8-5e7964a241b0/I-32ab/I-33ab.png']",RE
778,GENSHIN IMPACT,"HONKAI STAR RAIL, PLAVE, FIRE EMBLEM",PT. SINAR JAYA WACANA,I-36b,CF18,,https://www.instagram.com/mentega.fly/,https://twitter.com/mentegafly_,,,RE
783,GENSHIN IMPACT,"HONKAI STAR RAILS, ENSEMBLE STARS, PROJECT SEKAI, BLACK BUTLER, HAZBIN HOTEL, PRECURE, SONIC THE HEDGEHOG",Ayam Bara,I-38ab,CF18,https://www.facebook.com/Feli.chii/,https://www.instagram.com/aidhaaichii/,https://twitter.com/tash00kie_gs,,,RE
785,GENSHIN IMPACT,"FRIEREN, A SIGN OF AFFECTION, HSR, ONE PIECE, JOJO'S BIZZARE ADVENTURE, ANIMANIACS, TMNT, OMNISCIENT READER'S VIEWPOINT, PUSS IN BOOTS, SPIDERVERSE, VOCALOID, ADVENTURE TIME, SONIC, NIJIEN, GUMBALL, TOM & JERRY, POKEMON, LOONEY TUNES, DUCKTALES, TOUKEN RANBU, I SHALL BE THE MASTER OF THE FAMILY, BNHA, TOILET BOUND HANAKO-KUN, POWERPUFF GIRLS Z , YUGIOH , FGO , DELTARUNE , K9KURO, APOTHECARY DIARIES",Gaib [Gaji Artist Ilustrasi Bermasalah],I-41ab,CF18,,,,,,RE
786,GENSHIN IMPACT,"CALL OF DUTY, HONKAI STAR RAIL, JUJUTSU KAISEN, VOCALOID, ACROSS THE SPIDER-VERSE, STARDEW VALLEY, UNDERTALE, BREAKING BAD",Badak Salto,I-42a,CF18,,https://instagram.com/jechivva,twitter.com/jechiwa,,,RE
788,GENSHIN IMPACT,"PROJECT SEKAI/VOCALOID, ADVENTURE TIME, RED DEAD REDEMPTION 2, JUJUTSU KAISEN, HONKAI STAR RAIL 7. THE APOTHECARY DAIRIES/KUSURIYA NO HITORIGOTO, TWISTED WONDERLAND, NIJISANJI (TENTATIVE) (ANIKARA), HOLOLIVE, PENGUINS OF MADAGASCAR, A3!",Moracore,I-43a,CF18,-,https://www.instagram.com/moracore?igsh=NnNyY2diNHdrYmoz,-,,,RE
797,GENSHIN IMPACT,"HSR, REVERSE1999, TOUHOU, GHIBLI STUDIO, HOLLOW KNIGHT, MIKU, KIRBY, ENSEMBLE STAR, THE PROMISED NEVERLAND, SHERLOCK HOLMES, CONAN",KAKT Kumpulan Anak Kurang Tidur,I-50ab,CF18,,,,,,RE
808,GENSHIN IMPACT,"VTUBER, JUJUTSU KAISEN, HONKAI STAR RAIL, TEARS OF THEMIS, OBEY ME, NEWJEANS, LE SSERAFIM, POPPY PLAYTIME (SMILING CRITTERS), FRIEREN, HARRY POTTER, VOCALOID",Seonmul Aegis,I-59b,CF18,,https://instagram.com/seonmul_aegis/,,,,RE
810,GENSHIN IMPACT,"HONKAI: STAR RAIL, OMNISCIENT READER'S VIEWPOINT, IDENTITY V, ZENLESS ZONE ZERO, ARKNIGHTS, FURRY, OC",PCFC,I-60ab (SUN),CF18,,https://www.instagram.com/xipcfc.animasi/?theme=dark,,,,RE
812,GENSHIN IMPACT,"GHIBLI, MASHLE, GENSHIN, HONKAI, HOLOLIVE, FRIEREN, DEVIL MAY CRY, PERSONA, ERGO PROXY, THE WORLD ENDS WITH YOU, FEAR & HUNGER TERMINA, RYU GA GOTOKU",Alena's Atelier,J-01ab (SUN),CF18,,https://www.instagram.com/sluggish.cemeng/,,,[],RE
814,GENSHIN IMPACT,"HONKAI STAR RAIL, FRIEREN, DUNGEON MESHI, HAIKYUU",fey_cia,J-04ab,CF18,,https://instagram.com/fey_cia,https://twitter.com/fey_cia,,,RE
817,GENSHIN IMPACT,"HONKAI STAR RAIL, OMORI, PERSONA SERIES, IDOLISH7, LEGEND OF ZELDA, THE GREAT ACE ATTORNEY, ORIGINAL CHARACTERS",Kubis Asli Medan,J-06b,CF18,,https://www.instagram.com/pryntery/,https://twitter.com/fishcaakes,,,RE
